{
  "schema_version": "1.0.0",
  "writing_id": "home-writing-001",
  "revision": 1,
  "status": "approved",
  "body": "小户型玄关收纳，不一定要先买新的收纳家具。先观察每天实际取放的物品，再按使用频率安排位置。\n\n第一步，把鞋、包、钥匙等物品分开看：哪些每天用，哪些只是偶尔用。先处理最常出现的一类，不必一次整理整个家。\n\n第二步，为高频物品划出一个固定、顺手的位置。可以利用已有的托盘、挂钩或柜内空格；是否适合要看实际尺寸和租住条件。\n\n第三步，给临时物品留一个小区域，回家后再按用途归位。这个玄关收纳方法强调方便维护，不承诺空间变大或永远不乱。\n\n如果入口很窄，优先保证通行安全，不要把物品放在门扇、消防通道或容易绊倒的位置。\n\n这是合成演示稿，不含真实用户案例或产品推荐。你可以先从每天最常找不到的一件物品开始。",
  "body_sha256": "34e6a850c0572dd2b530f79c348ab4edf68904480026e6fba6b63a5fef400eb4",
  "updated_at": "2026-09-30T07:46:19.520524+00:00",
  "submitted_by": "synthetic_author",
  "approved_by": "synthetic_learning_human_mock",
  "finalized_at": "2026-09-30T07:46:19.520524+00:00",
  "rejection_reason": null,
  "supersedes_revision": null
}
